links,titlehttp://www.nytimes.com/2015/10/18/world/middleeast/iran-nuclear-deal-sanctions.html?ref=world,Now the Hardest Part: Making the Iran Deal Workhttp://www.nytimes.com/2015/10/18/world/asia/britain-to-put-commerce-with-china-first-in-president-xi-jinpings-state-visit.html?ref=world,Britain to Put Commerce With China First in President Xi Jinping's State Visithttp://www.nytimes.com/2015/10/18/world/europe/hungary-closes-border-changing-refugees-path.html?ref=world,Migrants Diverted to Slovenia After Hungary Closes Borderhttp://www.nytimes.com/2015/10/18/world/asia/india-writers-return-awards-to-protest-government-silence-on-violence.html?ref=world,India Writers Return Awards to Protest Government Silence on Violencehttp://www.nytimes.com/2015/10/18/world/asia/fearing-election-losses-taiwans-governing-party-drops-its-presidential-candidate.html?ref=world,"Fearing Election Losses, Taiwan's Governing Party Drops Its Presidential Candidate"http://www.nytimes.com/2015/10/18/world/americas/after-strong-start-in-canada-campaign-new-democrats-appear-to-fade.html?ref=world,"After Strong Start in Canada Campaign, New Democrats Appear to Fade"